"王生对佩蓉的爱不够坚贞,对小唯的爱不够坦白...",4,画皮
小唯超美，赵薇白发中毒那里演的不错。,4,画皮
常用标签里没有陈坤。。。看来他这次真的蛮失败。。。,5,画皮
赵薇升华了,5,画皮
咋就给了五星？当时着了狐媚？,5,画皮
音乐很好。日本人配的。。。。,5,画皮
两个女人一场戏,4,画皮
可我已经有佩蓉啦。这叫什么话。,4,画皮
相比还是更喜欢赵薇，别说妖精不懂爱，虽然她TMD是小三。,4,画皮
小唯很精彩,4,画皮
蛮感人的,5,画皮
7分,4,画皮
2008/9/28，北京王府井新东安，dyl,5,画皮
周迅灵气逼人，赵薇演的干净纯粹，看两个大花飙戏好爽,4,画皮
你不懂什么叫做爱,4,画皮
谁让他先来惹的我?,4,画皮
人妖恋,4,画皮
佩蓉：你根本就不懂爱情。小唯，与我一样同样不懂爱的女子。,5,画皮
好喜欢，好电影！,4,画皮
世间难有真情在。。如今小三难击败！！,4,画皮
周迅猛,4,画皮
"淒美的愛情故事, 周迅的狐狸精也太唯美了吧!",4,画皮
可是你还是爱上别人了，不管是不是在梦里。她白着头发奔跑出来时，痛到落泪。孙俪好像李宇春，还让我想到倩女幽魂里的虚竹的妹妹= =。。不过演得还好啦，配音选的都蛮有意思的。各位都演得很好，有说陈坤演得不好，其实我觉得他诠释对了，这么个忽真忽假、自以为很负责其实最懦弱的混蛋东西。,4,画皮
兩個女人一台戲。,4,画皮
第一部好看多了，第二部就是个X,4,画皮
爱情温暖生命,5,画皮
冲着赵薇去电影院看 为了这个我也要给四星,4,画皮
虽然甄子丹和孙俪始终不在一个拍子上，虽然赵薇演得很平淡，虽然周迅的拿腔拿调略显造作，虽然剧情有点琼瑶……但综合素质还是很均衡……,4,画皮
情感到位，看俩大花飙戏很爽,4,画皮
简单的故事 不简单的爱情,4,画皮
其实我觉得还蛮好看的= =+,4,画皮
对这种爱情故事看得太多了 不过还是值得一看的,4,画皮
我很伤心。无关电影。,4,画皮
我觉得还是很不错的，特别是特效,5,画皮
对6.5分不满，就酱。,4,画皮
看完印象挺深刻的，但是周迅还真是骚.,4,画皮
only with you can i find such beauty and happiness.,4,画皮
柔弱胜则钢 最美的是温柔,4,画皮
爱情是永远的主题，只要心还在。近几年，我最喜欢的一部电影，,5,画皮
四星给甄子丹【喂,4,画皮
只懂得爱而不懂责任的人，就是妖。,4,画皮
华语电影的优秀魔幻典例。故事充实，演员卡司强大，服装造型很讲究，导致全片剧情线稳定，画质考究不流于浮华。最后一首«画心»很好听。,4,画皮
为佩蓉给四星~,4,画皮
成功的商业电影,4,画皮
这部的摄影角度很非主流 陈坤太肉 周迅美极了 赵薇进步显著 孙俪声音最好 甄子丹很广东,4,画皮
信与不信之间，爱与不爱之间。,4,画皮
只不过因为她是妖所以你杀了她，如果她不是呢？,4,画皮
一切源起小唯的爱欲，一切由于王生的不坚，看了第二遍，虐的要死要死的，真的很好看,4,画皮
有周迅在，赵薇演技分分钟被秒啊，一只有心机却又爱上人类的狐狸精，被演绎的出神入化。主题曲画心也相当不错。,4,画皮
挺好的了，最起码比十月围城要好。我看了5遍，每遍都感动。,4,画皮
去电影院看的。。。太恐怖了。。。而且又一苦逼路线,4,画皮
一直心心念念的要去电影院看画皮，因为嫌网上下载的版本不清晰，现在终于如愿了~~~太喜欢周迅的缘故，所以看的过程难受了些，好在最后陈坤的一句：“我爱你，可是我已经有佩蓉了。”让我困惑许久的心，终于明了~~~要是我那么爱一个人，不知道会否有那样的勇气，成全他......,4,画皮
其实是个俗片，但是我被感动了。,4,画皮
整体不错。剧本写得比较草率简单。看点在周迅~,4,画皮
在思考了2个月以后，我发现这真是一部可以评4星的电影，周迅最后崩溃的场面让人绝望又充满希望,4,画皮
还不错~,4,画皮
小赵演技突飞猛进，小周一如既往地可爱,4,画皮
挺好的。,4,画皮
情也是妖,4,画皮
“可我已经有佩蓉了啊”这结尾传达的感情真是太赞了。赵薇好赞。其他都是渣,4,画皮
和旬子一起～再感人的电影都能看出2B处～～～可那拨了皮的妖造型也太假了吧～,4,画皮
很喜欢里面鲜艳的小唯，一只狐妖爱上了人便不惜一切代价苛求幸福。可是给了你爱，就不能放弃自己的责任。,4,画皮
再多種愛情其實都是一種,4,画皮
喜欢小唯,4,画皮
今年的大陆电影整体水平提高,4,画皮
通过中央六套又看了一遍。总之是个全世爱的故事。,4,画皮
重看了一遍，其实应该值得4星。画面不怎么样，但是该讨论的小三的问题已经讨论尽了。,4,画皮
  前半部根本没有节奏，不过后半部渐入佳境——我这评价还是很宽容的,4,画皮
周迅演技神了,4,画皮
结尾挺感人的,4,画皮
你们根本不懂什么叫做爱 赵薇说 .,4,画皮
"这个,我看睡着了..",4,画皮
挺好,4,画皮
我挺羡慕男主的爱情观的，也许有的人会觉得假，但我觉得很现实。,4,画皮
"王生开始梦小唯时是不是就是一种出轨?精神出轨?所以他说不相信我?一个陌生女子他那么肯定她不是妖,一个耳鬓厮磨多年的爱妻,仅仅是变幻了摸样,他便相信她是妖?他说不管你是人是妖我都爱你,女人为了这一句话自尽身亡,不理智的女人啊,你何时可以如男人般,有精神出轨又极其有理性地说出万分感性的话呢?",4,画皮
画皮容易画心难,4,画皮
给五颗星是因为我被感动了。,5,画皮
多亏周迅撑着这部戏,5,画皮
妖，很简单；人，太复杂。,4,画皮
没有宣传的那么好，但也不错吧,4,画皮
还是不错的,4,画皮
王夫人只有一个..,4,画皮
我觉得片尾曲非常好听，赵薇演技小爆发,4,画皮
"编剧实力不够,结局拍的不好!!!",4,画皮
13，我的怀里,4,画皮
喜欢赵薇的表演,4,画皮
没感觉……,4,画皮
还是有感动。,5,画皮
我终于看了，一个六角恋的故事，周迅很妩媚，赵薇很贤惠，孙俪很可爱。顺便提一句，陈坤的造型让我想起小时候看的连续剧《东游记》里的穿山甲,4,画皮
"真的,一般...但是现在在想想,大家都演得很出色,而且偶尔还很搞笑,浪漫的爱情故事",4,画皮
除了节奏有点慢，其他还挺好的...,4,画皮
“不论你是人是妖，我都爱你”个人却不能和他在一起。感动于庞将军对佩蓉的执著。,5,画皮
画皮画骨难画心···,4,画皮
这种爱情太伟大了 ,4,画皮
有些地方比较搞笑,4,画皮
至少还有画面。,4,画皮
没有我想象中好，但我必须承认周迅和赵薇真的不错,4,画皮
"爱,说不清对与错,那是不是精神出轨就是可以原谅的?",4,画皮
其实还挺好看的~,4,画皮
比期望的好很多啊,4,画皮
哎呀~~真的哭泣了啊~~,4,画皮
最后我居然听见了街上有人喊 两个六块一个三块= =     那时候就用块了吗....以及配乐究竟在想什么？！,4,画皮
画面不错,4,画皮
感觉还不错啊，陈坤大爱,4,画皮
从内容，表演，到主题歌都不错,4,画皮
由于片尾曲加一颗星,5,画皮
坤哥，,4,画皮
我一顿哭 一顿哭 虽然我知道 可能是挺老套的 但是这种放弃爱的 人 成全 别人的这种感情。。。。,4,画皮
营销学成功范例 ,4,画皮
歌好听,4,画皮
看在煽情把我和阿蚊煽哭了的份儿上，给个4星吧。,4,画皮
久违的爱情戏,4,画皮
一，是不是我恶俗了？看这种片子除了觉得赵薇的装真是画的太不服贴了几乎没有别的感慨了。二，我觉得吧，其实我喜欢这个很大一部分层面还是因为虽然有男小三女小三，但是每个人最开始喜欢谁，还就继续喜欢着。这种执着还有男一那种小三都脱了他还稳如泰山的定力，一定要看齐！,4,画皮
虽然被捧得有点过了，但确实不错，画面服装摄影都很考究，确有“东方魔幻”之架势，，音乐太电子游戏了，经常让我出戏。,4,画皮
你根本不懂什么是真正的爱~,4,画皮
我觉得挺感人的,4,画皮
无奈，终究变了心,4,画皮
我竟然下的是粤语DVD版本，别有一番风味啊。,5,画皮
周迅真是美,4,画皮
管别人，我喜欢,4,画皮
千年的道行依旧不敌一句“我爱你”,4,画皮
上一堂爱情课,4,画皮
结局太傻了,4,画皮
还不错,4,画皮
真是可怜的周迅，，，老演被陈坤负的女人,4,画皮
不吓人但还不错,4,画皮
不知道为什么就觉得好看,5,画皮
到最后..已不是谁是妖的问题...而是爱的问题...,4,画皮
其实我觉得还不错，古代的场景还原得挺好的。,4,画皮
老实说，这种对爱不求结果的执著真的很令人欣赏,4,画皮
★★★☆比想象中好。,4,画皮
因为爱情 。。,4,画皮
画皮这首歌响起的时候，眼泪忍不住掉下来了,4,画皮
太商业化的爱情电影。还好有周迅。,5,画皮
电影一般般，但最后一个画面实在太矫情了！4星。,4,画皮
2008 10 18,4,画皮
国内算是比较好的片子，所以给了五颗星。两个小时很快过去，不仅仅是因为好看，也因为可以有很多的内容插进电影却最终没有。。让整部电影的内容除了那似懂非懂的爱情之外，别无其他。。陈坤，到底什么是责任，你弄懂没有？！但是谢谢你，起码让我有了一个再一次认真思考到底什么才是责任的机会。。,4,画皮
周迅演白狐狸真是太恰到好处了~~~,4,画皮
爱情，怎么总是看不懂。。。这部里面可爱的丹丹，要赞一下～,5,画皮
挺好一部爱情片，这么个放在任何时代背景下都说得通的套路故事也拍得挺感人，演员演得都不错，我第一次发现赵薇有演技。周迅风声前的状态和拍风声后还是大不相同啊，语气眼神都不一样。片尾的狐狸萌得我一下出戏了，张靓颖再唱煽情歌曲也没用。这片里最美的人儿是陈坤~,4,画皮
即使王生为佩容自杀，但自杀前对小唯说的那句“我爱你”就不能让人原谅。,4,画皮
有小宝的气息：）,4,画皮
刀槍不入都只怕你的義無反顧,5,画皮
没有想象的那么好。,4,画皮
觉得本片最像妖的其实是王生的扮演者——陈坤。,3,画皮
剪辑不流畅，前半部分流水帐，结尾啰嗦而无聊。周迅的表演是最亮点。王生定位错乱，导演缺乏才华。,3,画皮
还是觉得赵薇挺好看的。,3,画皮
赵薇同样值得表扬,3,画皮
周迅越来越有味道了,3,画皮
王晶夸周迅说，“她以五呎的身高，绝非玲珑浮凸的身材，把一个狐狸精演得比任何一个性感女神都性感三倍。 这就叫演技。”《画皮》之于周迅本来可以成为《青蛇》之于王祖贤那样的经典代表作，可惜独木难成林。一个颠倒众生的狐狸精救不了一部烂片。,3,画皮
美人一张脸，王生晃花眼；蓦然一回首，一颗骷髅头。,3,画皮
画皮一出，人人怀念青蛇的好。如今画皮2一出，大抵是人人又怀念画皮的好了。,3,画皮
还是不喜欢赵薇，看咱家孙俪多舒服。。。,3,画皮
还不错，合适的演员演的不错的角色,3,画皮
赵薇变为白发魔女的那段演绎的不错，那种眼神真的很感人。,3,画皮
我始终无法同情周迅。两颗星给画心。,3,画皮
赵薇，陈坤，周迅，三个人的铁三角，真的配合的不错！,3,画皮
记得那时候看的时候真的有被吓到,3,画皮
原来喜欢不可以伪装，原来快乐不可以假装，原来永远和瞬间一样。,3,画皮
画皮难画骨，识人难识心，迅哥真棒，小唯再难见了，当年的娘娘还真是青涩,3,画皮
本来以为是恐怖片，但是却是一个爱情片，片中的人物不知道该心疼谁，觉得既可爱又可恨！,3,画皮
赵薇啊！！！！！！,3,画皮
个人觉得匠气很重的一部片，连周迅的灵动都所剩不多，拍摄技巧、故事情节阻碍了演员发挥。,3,画皮
都说心不在了，要皮何用？始终相信，世间没有永恒的情爱，能永恒的都已幻化为亲情，一张皮还包裹着责任。非常喜欢主题曲，演员都挺好，但没有什么惊喜。,3,画皮
画心,3,画皮
周公子真是……迷人,3,画皮
我还是觉得应该尊重原配把，我选赵薇，用手段得到的应该没法长久把,3,画皮
画面很美，只是感情方面感觉不是很喜欢,3,画皮
演员真的是演技派啊，大花飙戏呢，两个都挺喜欢的，本来故事里更喜欢小唯的，可是这里赵薇的角色也很可怜很让人心疼啊。,3,画皮
根据聊斋故事改编的电影 赵薇周迅陈坤都是当时一线当红的明星,3,画皮
断断续续看完了，不喜欢男主的人设,3,画皮
赵薇和陈坤好不搭,3,画皮
周迅演的很灵气，赵薇感觉被压的没有存在感了。,3,画皮
还可以，歌不错,3,画皮
虽然都是大牌演员，但是真的觉得一般，里面的歌曲挺好听的多加一星。,3,画皮
赵薇把王夫人的端庄稳重诠释的很到位，周迅把狐妖的妖娆与灵性也演绎的很有味道，全剧我只关注这两位女主角了。另外就是主题曲十分给力。,3,画皮
妖有画皮，蛊惑人心,3,画皮
其实算不错,3,画皮
陈坤很帅呢,3,画皮
剧情有点恐怖，不过都是大咖演技还是很过硬,3,画皮
周迅和赵薇的惊艳程度还不够，周迅没有红高粱那样的放开，赵薇也是，可惜了,3,画皮
隔了十年再看画面依然很唯美，小时候很不喜欢小唯来着，现在，心疼,3,画皮
周迅赵薇不愧是大花,3,画皮
为了2,3,画皮
谁说大制作就工业，小成本就感人。起码比李米会讲故事，不过不失就成功了。可惜场面不够大，特技少。没了王祖贤的美，妖都变平凡了。,3,画皮
赵薇和周迅的演技都很好，不错,3,画皮
挺漂亮的。,3,画皮
我始终无法同情周迅，画心很好听。,3,画皮
果然果然，就是争风吃醋的爱情故事。不过，事情的发展总是非常微妙的。,3,画皮
其实故事还是蛮好看的，就是脱皮的那个真真吓到我了。and周迅赵薇都好有味道。,3,画皮
一颗星给音乐 一颗星给两个女主角 一颗星给服装道具化妆灯光,3,画皮
现在看也是平平，所以这么高的评分是？给演员还是导演的？,3,画皮
还可以吧,3,画皮
3.5  1.没那么差。2.周迅、赵薇、陈坤、孙俪都演的不错。,3,画皮
一般吧…感觉是个魔幻片，与我理解中的聊斋相去甚远，大概是为了迎合当代的审美吧，不懂。。。,3,画皮
真吓人= =,3,画皮
情爱里无智者,3,画皮
這全都是因為我對你的愛。,3,画皮
古时候在念书人姓氏后面加“生”以示尊敬，比如画皮的王生，西厢的张生。且不论化身为武将的陈坤还适不适合称生，单赵薇一口一个“生哥”就够让人雷倒，如同今天管丈夫叫“先生哥”…………嗯，别样亲昵,3,画皮
一直挺喜欢周迅的，她的小唯让人心痛，好悲伤好凄美,3,画皮
爱情真是……,3,画皮
画人画皮难画骨,3,画皮
能给四星的，无奈这戏迅哥儿小三演的太好以致于我讨厌了她好长时间(￣▽￣&#34;) 减一星【喂！,3,画皮
在电影院看的，也就那样吧。所谓脱皮那段也就那样而已咯。,3,画皮
说实在的，我真的挺不喜欢看恐怖片的,3,画皮
这算什么，台词好烂，陈坤演技不行,3,画皮
孙俪 你真萌啊···,3,画皮
讨厌甄子丹,3,画皮
你爱他，他爱她，她爱他，他又不爱她，他又爱她，她最后居然又爱他。。。牛逼,3,画皮
也就可以看,3,画皮
爱情片。。。,3,画皮
小三想转正,3,画皮
“你这个吃苍蝇的，根本不懂什么是爱情！”,3,画皮
一个惊悚题材的故事拍得和白开水一样平淡,3,画皮
孙俪啊你就是个悲剧,3,画皮
很细腻的片子，不闷。孙俪和甄子丹真算是欢喜冤家了，不知道赵薇和周迅对调对方的角色会是怎样的效果,3,画皮
跟英杰哥和小野姐滴美丽回忆……永远记得“找手机”,3,画皮
一般，没觉得特别好看，主题曲挺好听的。,3,画皮
错位的爱～越画越邪～画面做的跟网游宣传片似的～,3,画皮
大家变妖之后都好看了很多,3,画皮
原以为是恐怖片，如今才知是部爱情片。,3,画皮
女人啊。。。里面很多的话都是有所经历的人才能够一下子说出来的。,3,画皮
我不吃人心，会老的。,3,画皮
哎。。。。,3,画皮
CCTV6。。。,3,画皮
其实，比画皮2好很多,3,画皮
噱头足够，内容疲软,3,画皮
"画面很漂亮,尤其是开头.那个妖的原生态没必要用特技做得那么恶心,全是虫子.感觉导演应该进一步颠覆一下原来的故事,即然能多了勇哥和什么捉妖帮的女道士,也完全可以让那雌雄难分的妖爱上王夫人,让王生面对着自己老婆的女同性恋问题束手无策,故事看起来会更有趣.",3,画皮
"不管你是人是妖,我都爱你.",3,画皮
一般般，再也不相信媒体了,3,画皮
画皮想要让你去敢相信，美色面前绝不变心的男人并不是没有的，女人要对自己充满自信。但是，我依然不信这种鬼话= =,3,画皮
我觉得赵薇成熟得好美人，只可惜又嫁走了一个。,3,画皮
观影体验还行。,3,画皮
剪辑有大问题。,3,画皮
那个时候看的迷迷糊糊，剧情就这样吧，画面美吧。,3,画皮
冲着蒲松龄先生，应该不给星星，但冲着片中赵薇2个精艳的造型和场面制作，给个还行的评价吧,3,画皮
坤姐你怎么man得起来~~,3,画皮
特效效果在国内已经算不错的了，剧情逻辑还是漏洞多啊，女演员不错。6.9,3,画皮
给美工加了一星,3,画皮
我是一个降魔者…… PS:片头的周迅太惊艳了,3,画皮
现在想起来有点搞笑，和怎么办先生开始,3,画皮
补上分数，只记得开头和结尾的那只蜥蜴了,3,画皮
三位女主各有精彩，周迅一贯的水准之上，赵薇第一次演技说话，孙俪分外抢镜~,3,画皮
不及老版的韵味。,3,画皮
结局太俗,3,画皮
画面不错，整体一般,3,画皮
小周迅真可爱,3,画皮
没有想象中难看 只是一般难看,3,画皮
我被爱情感动了,3,画皮
除了华丽的汉服外什么都没有,3,画皮
就记住了赵薇的装束,3,画皮
情节粗糙 还是无法忍受赵薇 虽然她这部演技还好,3,画皮
看的我好纠结，看哭了呐~ 狐狸精一直没看到身边对自己好爱自己的蜥蜴精，厂花明明动心了，还要装忠贞，但是最后还是证明了有些男人就算心理出轨了，但是会负责会克制自己，也算好男人嘛。。。。。 ,3,画皮
小于期待值,3,画皮
比預期的好一些,3,画皮
表扬下美工，结局太忽悠人了，浪费人感情么不是~,3,画皮
人与妖，人与人之间差别何在。一张皮换上妖就是美女，而人撕下这张皮呢！,3,画皮
曾经水灵水灵的赵薇啊，岁月真是不饶人～特效很差，砸下去的100万美元看不出效果，同样是找老美来做，效果不如《功夫》,3,画皮
还Painted Skin...,3,画皮
可以看。。,3,画皮
特效像假的一样。。。,3,画皮
因为张靓颖让我对这电影稍微有点好感,3,画皮
这片儿没啥好哭的,3,画皮
开始看的时候还很有感觉 可是看完之后。。。发现 真的没有什么剧情  没有什么留下。。。,3,画皮
享受了甄子丹原音.,3,画皮
蜥蜴,3,画皮
经过这样的事.佩容还怎么能跟王生在一起呢?,3,画皮
脸上抹了好多粉啊~,3,画皮
好狗血,3,画皮
最后大家都披头散发，皆大欢喜咯！,3,画皮
这不是魔幻片，这不是恐怖片，这也不是惊悚片。以上这些都是电影宣传时的噱头，这其实只是一部爱情片，还是一部告诉你如何成为完美小三的电影。公正的讲，在香港导演北上拍片大潮中，这部还算不错的了。,3,画皮
赵薇白发+血泪惊艳,3,画皮
哎,3,画皮
音乐很美，真不知电影的名字和情节怎么对应的起来 ,3,画皮
删掉最后十分钟还行,3,画皮
"虽然一般,但是我还是哭了",3,画皮
大概是陈嘉上这个烂片王拍的最好的吧,3,画皮
尽管开篇剪辑有点生硬，但是整体来说，还是高于预期的~情感方面做得很到位，并且每个角色都塑造得还算鲜活，喜欢周迅，喜欢那一段跟拍赵薇的镜头,3,画皮
我端正了态度，去美嘉看了[画皮]。故事还不错，但为什么这样拍呢？ 但重要的是，到影片结尾我才看出那条bl暗线呀，坤美人最爱的是庞勇！黯然销魂……,3,画皮
一个主题：画皮者怎么也看不透这爱。,3,画皮
为啥子赵薇总是那么的苦命呢？,3,画皮
周迅出场还是蛮惊艳的,3,画皮
本子不怎么样，但演员真是很强,3,画皮
给三分！我觉得及格了！还是初中的时候上映第一天去看的～,3,画皮
我真感觉。。。女人好脆弱，真的那么喜欢这种粗枝大叶的影片吗？什么点那么吸引她们呢？,3,画皮
要不是剧本好。。。。。。聊斋志异可以的。。。。。。。,3,画皮
小狐狸很pp，就算最后的画面不是很美好，小蜥蜴毕竟是。。。,3,画皮
拍烂了的片，如果换成张曼玉，梁朝伟们……,3,画皮
故事的基本结构是这样的:陈坤和甄子丹本来是战友，两个人都喜欢赵薇。赵薇选择了嫁给陈坤，甄子丹愤而远走。赵薇怀疑陈坤喜欢周迅，进而发觉周迅来了之后，城里开始死人。认准周迅就是妖怪,3,画皮
1颗星给周迅赵薇，那个王生实在混蛋,3,画皮
“有时候，我们愿意原谅一个人， 并不是我们真的愿意原谅她，而是我们不想失去她。 不想失去她，唯有假装原谅她。”——《画皮》,3,画皮
张靓颖的歌真好，周迅演的也好。,3,画皮
赵薇演技有突破，可小三的实力也不弱。,3,画皮
火了一首歌，验证了周迅演小三的实力，同时证明了赵薇不愧是演过姚木兰的人啊...,3,画皮
结局挺雷的，除此之外都很喜欢，拍得很美，赵薇让我惊艳了,3,画皮
周迅演的好是好。但是她一说真的吗的时候我就想哭了。可惜了一个美人。,3,画皮
佩蓉憋屈得太不够了 明显良家妇女是斗不过小三的。。。巨大的问号——为什么她会怀疑她是妖呢。。。很突兀,3,画皮
@周迅 你的演技和美貌是要将@赵薇 置于何地？,3,画皮
真是人也痴情、妖也痴情……可是这电影，从造型设计到音乐，怎么都那么像电子游戏啊？~~~,3,画皮
俗，放在九十年代，它能算什么？,3,画皮
以前被室友天天放主题歌逼得只好看了，还算是中规中矩，三星半还是可以有,3,画皮
《画皮》是带有很强的古典人文气息，陈坤扮演的文武双全的王生很有风采，身上蕴藏着几分让女子动容的魅色,3,画皮
第二次太无聊看居然快看哭了。。。。。。。。,3,画皮
何必是这样的结局呢,3,画皮
剧情两分，主题曲不错多一分,3,画皮
演員都是喜歡的 但劇情一般般 。,3,画皮
能引起大家这么多评论的。就不错了。,3,画皮
除了音乐还可以，其他的不值一提。编剧真是脑残……,3,画皮
2013.3.19 22:15,3,画皮
故事确实糟糕，摄影和演员其实蛮好，台词很不合气氛,3,画皮
我觉得还是配乐比较好听。,3,画皮
看了这部更加喜欢周迅多一点，更加不喜欢赵薇多一点,3,画皮
能看,3,画皮
想怎样 = = 三星是给周迅的！,3,画皮
算是国内比较早期且质量也过关的玄幻片了。视效并不差，少量的特效加不错的美工，主要还是以实景打底。当然剧本还是一般，最后也是落入俗套，一些细节倒很赞。最大的问题还是高潮解决得太随便，整部电影将近3分2在明争暗斗，期间有些不痛不痒的动作戏，可最后却突然前功尽弃，简单粗暴后只剩一口的干涩,3,画皮
感觉没那么好，但也不算差。可绝对不是原著。。。,3,画皮
其实这故事挺好的,3,画皮
最跟到底 男人还是徘徊在白玫瑰和红玫瑰的问题上,3,画皮
还算好~,3,画皮
20081011 青年宫电影院,3,画皮
真和谐！,3,画皮
果然什么样的电影被CCTV6一介绍就好看很多~然后看了其实也就这样~TAT,3,画皮
貌似真的不恐怖,3,画皮
重温/导演剪辑版。你根本不懂，什么叫做爱。可试问，又有几个人能算真正懂呢？！,3,画皮
陈坤你要不要演的这么假 周迅加星 豪杰你太TM像甄子丹了！！,3,画皮
对于这种鬼啊怪啊的 实在不行= =,3,画皮
没有一丝恐怖，周迅身上没有小唯应有的妖气，再也没有第二个王祖贤了,3,画皮
人不象人，鬼不象鬼，而最大的败笔··是甄子丹和孙俪,3,画皮
老听同事唱主题曲，才看电影。,3,画皮
最后有点小感人…,3,画皮
