年代记实录，看了让人不舒服，特别是里面的台词，虽然他们在拼尽全力的活着，可是却又显得如此可笑和悲凉。“小鸡长大了就变成了鹅，鹅长大了就变成了羊，羊长大了就变成了牛，牛长大了就是共产主义了。”,4,活着 
个人认为是张义谋最好的电影。,5,活着 
能活在现在这个时代其实还是很庆幸的了，虽然天朝依旧威武。,5,活着 
一个时代有一个时代的悲哀和可笑，你能在别人心酸的故事中读出些许温情，也能从自己的平凡中领会些许荡气回肠。电影少了原著的惨烈，但那种好死不如赖活着的悲凉还是存在的。,5,活着 
中国不是没有好电影，而是真正好的电影没有在这个社会喘息的余地。竟沦落至此，天涯同道，难语归途。友庆死掉的那段，泣不成声，不忍卒读，他们逃不过。,5,活着 
演员选得很好，巩俐演啥像啥。但整体没有小说感人，可能小说太残酷了吧。兴，百姓苦；亡，百姓苦。活到最后的人，往往最痛苦。,4,活着 
国家走了一小段弯路，对于一代人就是蹉跎了一辈子。生活不易，还是得这么活着。笑中带泪，死人堆里暗暗许下活着的誓约，可谁也不曾想大环境下生活的艰辛。国师在第五代导演最好的时期奉献了极其有温度的作品。经年以后，鹤发的富贵摇着蒲扇回想那天不让有庆上学，少买几个馒头就好了，可生活不曾回头。,5,活着 
个人认为张艺谋最好的电影，可惜这样的电影被当局禁了，因为固有的自卑。9分,5,活着 
活着就是一切！戛纳评委会大奖，老谋子最好的电影。,5,活着 
长太息以掩涕兮，哀民生之多艰,5,活着 
"家珍对撞死有庆的春生说“春生，你记住，你欠我们加一条命呢，你得好好活着！“这就是温情吧，在一个大家都要和走资派划清界限的年代,，不得不说家珍是一个很坚韧的女子。",4,活着 
改编自余华的小说【活着】。很好看。书和电影都好看。活着的人比死了的人还痛苦。我觉得是的。,4,活着 
从一开始不可能让人哭，我就哭得一塌糊涂，因为这部片，又不全是。,5,活着 
中影史：影片透过一个人的一生遭遇，涵盖着人在历史中的命运无法掌控的生命之痛，衍生出了对死亡的苦笑。全片具有一定的史诗性，这种史诗性被包装在个人和家庭的命运之下，同时隐隐露出一股的悲悯情怀和伤感的黑色幽默。影片的个人生存状态和苦难，在经过精简的历史背景里，体现出小人物的悲欢离合。,5,活着 
看一次骂一次,4,活着 
有些人活过来了，有些人死去了，命运，往往不肯将幸福给予善良而又卑微的人们。 反而叫那些人们一惨到底。。。,5,活着 
不看的话人生就不圆满!,5,活着 
葛优成功诠释了一个从嗜赌成性吊儿郎当的纨绔子弟变成一个被生活打磨得没有一点棱角知足软弱的老头儿。,5,活着 
思想反映的越深刻，越是要封杀，这就是广电总局的理论。,5,活着 
因为是电影，所以皮影和箱子做线索好。////其实我想到的是“贫贱夫妻百事哀”——当然要我去过这贫贱日子，我也会去过。/////小说再怎么说也是属于少数人的悲剧故事，而电影则是属于大多数人自己的故事，更有质感，更加震撼。这电影太陕西了。,4,活着 
先看的小说 才找出这部电影来看   很喜欢余华的小说  大多写小人物的悲欢离合  这里主人公一家子的命运  看小说更能体会  我记得那个老爷爷弓着腰 吆喝牛 日出而作日落而息  一日复一日  土地旁的墓  那里有他的父母妻子女儿儿子  他们沉睡着 似乎能听到老爷爷的吆喝声,5,活着 
少年凤霞这小姑娘真水灵啊（大了之后也挺美的），这是唯一的亮点。故事和卡司是真不错，剧本是真糟糕，镜头语言很生硬，不知是编剧、摄影师还是剪辑师的问题，正反打视角不符合逻辑，每场戏都讲不透就换到下一场了。剧情贪多嚼不烂，跟《蓝风筝》一个毛病。,4,活着 
张艺谋最好的作品，即便不少广播标语甚至背景无法翻译传达给外国人，仍然斩获戛纳评审团大奖，葛优也凭借超凡的演技加冕影帝。即便小说和题材占得不少先天优势，老谋子的改编依然居功至伟。影片配乐带入感极强，摄影沉稳大气，黑色幽默里满是政治讽刺，平实质朴中尽显悲凉无奈。（9.0/10）,5,活着 
活着就是他妈遭罪，可死了又不甘心。,4,活着 
历史背景太严肃 总觉得下一秒就会是悲剧 一路想着这么看完 反倒有点释然,4,活着 
对于生活在我们这个年代的人来说 这无疑是一部科幻片 （文革很科幻··）,5,活着 
如果你觉得自己很惨，那就去看看《活着》。,4,活着 
经典，演员演技好，张艺谋最棒的作品，虽然活着不易但必须得活着才有机会！,5,活着 
活着究竟是怎样呢？生活在现在的我们应该庆幸的不止一点半点吧！,5,活着 
半个世纪过去了，我们依然身处在这个荒诞可笑的社会里，一直都是活着，从未走进生活。,4,活着 
才看。一个月前看了原著，都好都苦，都要顽强的活着。,5,活着 
因为老谋子的改编，是影片看起来没有原著那骨子压抑的绝望，更温情了一些。,4,活着 
就算生活已经千疮百孔，中国人还能隐忍地活着，哪怕这些荒诞和苦痛都是由自己亲手砌起来的。传说这是张艺谋最好的一部电影，大概就是好在把那些人们已经闭口不谈或者选择性遗忘的东西拿出来说，而且说得隐晦而丰满吧。,5,活着 
电影虽然已经看哭我好几次，但整体来说还是没有小说好看！,4,活着 
活着是最好的交代。在这部片子里找到了巩俐的风采。没有荷尔蒙的影响却依旧使人感触万千的电影。,4,活着 
自认为是张艺谋最好的一部作品，巩俐和葛优的演技不用多说。真是活着遭罪，死了不甘。,5,活着 
和原著有些差异，但电影改变无可厚非，给里面演员的演技打call，特别喜欢凤霞，有庆的设定我更喜欢书里面的，这孩子死的时候哭死了😭,4,活着 
唉.. 終於看了活著，那時候法語課說戛納課上放了活著一開頭往後再也沒看過，初中老師介紹過小說，也沒看過，今天終於看了電影，總覺得張藝謀更適合這樣的風格同時鞏俐，她是活著的家珍，她是霸王別姬的菊仙，都比她穿金戴銀花枝招展濃妝豔抹要美太多太多,4,活着 
人生不易，不同的是带有着不同的苦难。,5,活着 
眼看着时间越变越少，家里面还有那么多人，急得很呐还不死绝，没想到就没了。禁个屁啊反映的真实面不过三寸。,4,活着 
一部很走心的电影，剧中的家珍遇到任何事情的时候都没有埋怨过富贵，默默的陪伴相守，引起我们的反思。,4,活着 
福贵一辈子经历了太多的酸甜苦辣，到头来还是活着了，日子也越过越好了。,4,活着 
电影保持小说的悲剧基调，在结尾寄予了对新生活的希望，在悲剧中又透露着美好。两者的异曲同工之处在于“活着”，不管生活怎样，我们要为了活着而活着。同时两者各有特色，电影为了美好生活而活着，小说不论美好与否都要活着。不论是电影还是小说，最终传达的意思就是“活着”。,5,活着 
虽说和原著有偏差，但实在也太让人伤感了。过于真实和讽刺，最好的余华和最好的张艺谋。,5,活着 
一部2小时的电影，记录了近代中国的变迁。忘不了巩俐在深巷里的痛哭。一户人家，命运经历了大起大落，痛苦有过，幸福也有，终究还是活着。此时此刻我们都活着。,5,活着 
原著和电影都值得这个满分，引人深思的一生，小人物也有小人物的活法,5,活着 
活着是为了什么啊。就是活着啊。活着，就已经用尽全力了。,5,活着 
风雨飘摇 社会动荡都不是借口。你要告诉我那个时代有多压迫 那个时代有多难堪 那个时代有多不公 我想说你让我看到的只是大家没有改变反抗的想法 哪怕是一点点。,5,活着 
被书虐完后硬是撑着看了电影 葛优不愧是因此片而成影帝的 一个眼神就能映照出苦难的面目 但是不太喜欢电影为了控制节奏而改了许多剧情 还是无法表达出余华对生命的理解。最后，禁片还是有原因的啊，还原了历史的原貌，看了对体制牙痒痒。,4,活着 
张艺谋的影片总是很有深意，艺术感很强。死终究是归宿，应该怎样活着？看男主人公的经历，我们都会有不同的答案。,5,活着 
人啊，活着时受了再多的苦，到了快死的时候也会想个法子来宽慰自己。,5,活着 
影片情节与小说原著差别较大，只是借助了一个框架。影片给人最深的印象是真实，没有粉饰，这也应该是被禁的原因吧。说句题外话，那个年代，至少演员很敬业。,4,活着 
书是十几年前看的，把我看哭了好几回，唏嘘不已。前几年老婆也看这本书，然后躲被窝里没完没了的哭，说太惨了太惨了。我说惨的还在后头呢，她就哭得更来劲了，最后看完哭得双眼红肿，说怎么死绝了？所以我决定不再看。结果今天看了电影版……演得真好。结局也稍微改了一下别太惨了。这片现在过不了审。,5,活着 
非常优秀的一部作品，只是看完之后心情有些沉重。活着就好。,5,活着 
【A】不愧是张艺谋第二好的电影，剧本、演员、摄影、艺术成就都好的不能再好了。剧本上有余华的原著加持，虽然还是迫于审查压力对结局进行了大改，但仍是顶级的电影改编剧本，兜兜转转中依旧充斥着直击人心的力量。葛优与巩俐不愧为中国最好的男女演员之一，角色的年龄跨度之长、内心转变幅度之大、最终完成度之高，无不令人惊叹。至于摄影和艺术成就，我觉得比张艺谋以后所有古装电影都好。在光影的配合下，屏幕上的那个世界从头到尾都透露着一种坚韧的生命力和荒诞的时代感。其中两幕刺刀刺进皮影的镜头，寓意极深。以皮影代指富贵的一生，这个点改编的极好，极好。唉，好歹当年这样的电影还是给拍的...,5,活着 
葛大爷和巩俐非常棒了。人世浮沉，好好活着。,5,活着 
比较喜欢他的这部片,5,活着 
人是为活着本身而活着，而不是为了活着之外的事物所活着。,4,活着 
很好的还原了书本的画面和情节，不错的片子。,4,活着 
4.5。最珍贵和区别化的就是土气，一种通俗又不浮躁的土。仅论艺术价值会低于很多同类，却必是使我在内容上收获最多的一部。那么多年，时代一直在影响个体，而个体对时代的唯一影响或许就只有“顺应”，不抵抗永远不意味着不抵抗。活着太难了，活着就好了，家一直不得不为国，但家总不是因国生的啊。,4,活着 
不说了。立意深，好看，虽然看不懂，但是值得看一下，发人深省。,5,活着 
非常深刻的电影，葛优和巩俐都演绎得不错,5,活着 
修复版再刷。倒不至于因为对原著改动太大就不喜欢这部电影，只是它远非张艺谋最佳，无论怎样评价它，都难以避免“改编偏见”和“政治同情”。前四十分钟，表演、置景、打光无与伦比，从愿赌服输折射整个中国封建伦理中的契约精神，是看过的国产电影里最行之有效的“古装”戏。只可惜故事里共军出场后国师神采全无，其实并没进行什么批判，只是展示而已，但就这样也是展示得遮遮掩掩，反思力度跟《芙蓉镇》等完全不能相比。这部影片证明，如果把自己的立场完全藏起来只讲事儿，电影会变得多么泛泛而谈，连葛优、巩皇、姜武儿三位超群的演技也仅仅成了帮故事走过场。前半部分将原著里疼的东西变得更直观了，后半部分将原著里疼的东西变得不疼了，国师这“巧手”该佩服还是得佩服的。音乐有滥用的倾向。表达不畅带来节奏问题，更像半成品，渴望谁能重拍。,4,活着 
好死不如赖活着，活着就有希望。,4,活着 
前40分钟非常好，值得称赞的两个镜头一是刺刀刺破皮影幕布，二是战场上黑压压的人跑在雪地里处理很棒。后面内容略微有点水，结尾处理反倒弱化了悲剧色彩，难道是艺术处理后坟头上长出来的那朵小花？免得让观众过于悲观？（可以肯定我看的是删节版！！）另，演员的表演太好了，增色不少，姜武尤其好,4,活着 
四星半 能把书改成这样不容易 用了一天晚上先读了书又看了这个电影 感觉挺温暖的 被书深深折磨的我的玻璃心总算找到一个出口 但感觉书更加有关于“生命”本身 也更有深度 电影把笔墨过重地放在了文革上 ps葛优演技很棒 巩俐那时候真美啊 一脸的胶原蛋白,5,活着 
C＋ / 影片的建立基础有一条颇为尴尬的矛盾。一方面是用比较浅表的时代感与偶然的戏剧性来推动人物前进，并在这一被动的过程中呈现底层的自主、尊严、蒙昧、压抑等极为矛盾而复杂的生存状态；但另一方面，前者的戏剧性与时代感中所显露出的不可避免的倾向与局限又在削弱后者近乎自然主义的力量。或许还是前者的挖掘功力有所欠缺造成的割裂。,4,活着 
终于又下定决心，不怕牺牲，排除万难，去看禁片儿了……电影《活着》，根据余华小说改编，张艺谋执导，芦苇编剧，葛优、巩俐、姜武主演。被禁止在中国大陆上映。张艺谋妥协前的绝唱。看完本片，看花絮。那时的张艺谋、巩俐和葛优都是那么年轻而有才气…唉…你说为啥张艺谋现在…不说了……,5,活着 
一直听说过，就没看过。当年好像选了田壮壮的《蓝风筝》，就故意忽视它。。还是那句话，时代下的小人物永远只能随波逐流的顺势，能够带着苦难好好的活着实属不易，中国没有历史，中国只有轮回。。,4,活着 
虽然比不上原著，但也真的是经典了，选角真的绝了,5,活着 
张艺谋巅峰之作，一个时代。,5,活着 
无论发生什么，“活着”是不容怀疑的。,4,活着 
老谋子以前拍的片都不错，现在越来越让人讨厌了,5,活着 
好看，书也好看。电影还是给了点希望的，书让人绝望。,5,活着 
如今的张艺谋倒退了好几十年啊。。,5,活着 
生命无常,5,活着 
重刷日版蓝光，张艺谋最好的电影了。,5,活着 
张艺谋最好的片子，朴实的人性远胜于浮华特效。,5,活着 
张艺谋最好的一部电影,5,活着 
生下来活下去，生活再艰难也得坚持住,5,活着 
希望有更好的反映中国时代的电影。不仅仅是一部《活着》。,4,活着 
影片中的绝望、无助、无力在黑色幽默里得到转变，变为中国人在艰难生存状态下的忍受。,4,活着 
那个时代活着就是希望吧，活着很难，有时候觉得人生下来就是为了吃苦的，珍惜眼前的幸福吧，珍惜现在的时光，活着不易,4,活着 
我TM都看三遍了我容易么我TOT,5,活着 
一个人，一个家庭在洪流下被命运颠来倒去。隐喻恰到好处，没有扭扭捏捏的遮掩，却还是被墙了。如果连这样的电影都被关了禁闭，哪有资格去指责那些正在拍烂片的人呢，是我们自己默认了现在正在眼睛里发生的一切。,4,活着 
哭了很多很多遍。。。。人活着真的不容易。。我要好好活,5,活着 
几千年来，老百姓都盼着鸡变成鹅，鹅变成羊，羊再变成牛，牛最后变成什么？早些时候，是并耕而食，是小国寡民，是天下大同。到后来却让鸡不成鸡，鹅不成鹅，羊不成羊，牛不成牛，人也不成人。,4,活着 
私认为，《活着》和《霸王别姬》是中国电影史上最好的两部作品。在这部影片中，无论是葛优和巩俐的演技、张艺谋的指导功力、赵季平的音乐，甚至是余华的小说都得到了升华。一部《活着》就是整个中国近代史的缩影，它是张艺谋导演最好的电影作品，没有之一。,5,活着 
老谋子和余华相比有妥协，起初余华很佩服，后来还是被禁了，余华就不佩服他改佩服后面的大佬了。现在看，条目还在，也说明了妥协的一个好处，即使是妥协的产物也几乎快成了孤本。作为中国人，生，不容易。活，也不容易。生活，更不容易。福贵的一生太惨了，张艺谋删减加工之后，还是太惨了。,5,活着 
和后来的《归来》一样，老谋子的诉求一直是“温和的鞭挞”。余华的小说如暴风骤雨，一卷就带走了福贵的一切，老谋子的电影像太阳雨，有阳光带来的温暖，大雨带来的不适也是真实的，前者说的是苟且，后者说的是放下，两者，都是活着。,5,活着 
巩俐的家珍演绎的非常好，真的是他们家的珍宝，从赌场找回福贵、福贵不在的时候一个人支撑家里面、坦然面对从富贵到赤贫的落差。有庆的死去和小说里处理方式不同，都挺让我难过的。,5,活着 
她只是希望他回家。他只是为了回家。,5,活着 
一个小人物和小家庭变迁，社会历史真实性，小家庭也有梦想，。,5,活着 
"只要还有家人,就有活着的意义,只要活着就有故事,活着就是最好的心意!!~~~~鸡长大之后就是鹅,鹅长大之后就是羊,羊长大之后就是牛,牛你长大之后呢?---------张艺谋电影!!!葛优巩俐,演技无可挑剔, 演绎着福贵家珍两个充满了灵魂的人物.,一个愚昧.一个守旧,但默默地坚持活着是对那个时候的赤裸裸的讽刺",5,活着 
影片的故事很亲切，很真实，就像发生在观众身边一样。一个小人物在巨变的历史中浮沉，遭遇不幸和坎坷，完全不能掌握自己的命运。然而他从没有放弃活下去的信念，从不怨天尤人，并且对生活和未来报着无限美好的希望，让人感动。,5,活着 
生不如死叫做活着。年代叙事法，用那个时代的一件事表明ZG的可笑讽刺之处，跟蓝风筝手法一样。牛长大后，日子的确变得越来越好了，可是我们不会忘记我们离开那段日子只有半个世纪，我们也更清楚的认识到真相。这样的日子会好到哪里去？？巩俐和葛优的演技那时候真的很棒。,5,活着 
在中国，每个人都在喊着过幸福生活，但大部分人都只是在努力着如何生存，和残酷的现实做激烈的斗争，没有尊严的事做的太多，也渐渐麻木，以至于后来也想不起来初衷却只是想过个安稳日子。这部电影里的福贵又何尝不是这样，他放弃所有的尊严，低声下气，一而再再而三的苟喘偷生，就只求生存。,4,活着 
最佳的还是医院那场戏，历史的荒诞感和人物被历史裹挟的无力感被生动地演绎。“大团圆”的结局温暖有余，力度不足，这可能是张艺谋自我审查的妥协，讽刺的是这样的自我妥协等来的还是禁映。所以不得不说，最佩服的还得是共产党,4,活着 
凄凄惨惨...虽然没有余华书表达的那么具体那么有深度，但是那种那个时代的荒谬，种种无奈，隔阂。让人无比动容，黄土高坡上，时代环境再怎么整你，也应该好好的活着。或许这是我们这代人，永远无法理解的无奈，但是在这个伟大的时代，好好活着，好好的做自己认为对的事，不枉此生啊！,5,活着 
活着简单可就是艰难啊！总得直起腰板走下去！,5,活着 
结局比书里的好，总算不是个彻底的悲剧。【书里只剩福贵和那只老牛相依为命啊……但悲痛的感觉就这样弱了，不够强烈。啊，老谋子，木有余华的原著为基础你总是拍不出这样好的电影的= =,5,活着 
生活再艰难也要活着，喜欢巩俐和葛优的演绎,4,活着 
人活着就比什么都强,5,活着 
余华的原著看过，比起来还是电影更好些，精炼了一些情节，没有了原著那种死人刹不住闸的荒唐感。把皮影箱子作为一个贯穿全片的线索，在不同的社会背景下表现了不同的功用，使全局有一种完整感。近期补习张艺谋电影，早期作品还是不错，以后的路在哪？,5,活着 
非常棒，强强联合。,5,活着 
鳳霞死的時候，我徹底崩潰了………  中國有著世界上最能忍最堅強最命大最偉大的十幾億老百姓，只爲了最最卑微的‘活著’倆字，似螻蟻般苟活著一撐就撑了幾千年………  我無語凝噎,4,活着 
【1994年戛纳评审团大奖】【1994年戛纳最佳男演员奖】如有人所说，看过这片子的会分成两派。咳，其实个人来说是不喜欢这部电影的，总认为是沾了原著的光，而且比起当年同为评审团奖的《烈日灼人》，实在说不上深刻...总之偶是偏执的谋黑！话虽如此，喜欢的人还是不少。,5,活着 
那辈人经历了那么多走过来真不容易~能好好的活着就是最大的期望。这部片子主要还是原著好，有个好剧本就有一个好的故事题材，才可能有一部好电影。除了同情、感觉到人物的命运悲惨，最后，见证命运历史的皮影盒子里装着生机勃勃的小鸡，不正是象征着未来孕育着希望么？,4,活着 
张艺谋最好的电影,4,活着 
这也是在邓论上看的～换碟时忘了调音道，那个&#34;家珍&#34;一叫，乐乐和钟钟都说，原来粤语和上海话的这个是一个叫法呢,4,活着 
活着，比什么都重要。PS。禁你妈的比，傻逼当政者，讲点历史事实就禁，擦你妈的就这尼玛还想中国电影进步呢，进你妈的比步，傻逼。,5,活着 
看看张艺谋现在的电影，在看看这些，哎，这世界到底是肿么了。谋爷这几年是想开了还是吃错药了。这一个活着的历程看着真的心颤呢，家变，国变，意识形态都变了，这种背景和经历让活着显得好纯粹啊。我们这代人多少还从父母那里耳闻过这些经历，90后或者00后会怎么样啊，这应该作为一种教材。,5,活着 
张艺谋最好的作品并非今时令人眼花缭乱的各色大片，而就在于往昔那隶属大时代背景下小人物的《活着》，质朴简单的镜头却营造了最好的剧情张力，沧海一粟契合命运的种种呈现，一场为了能活着五味杂陈的演绎，悲凉的宿命是为人共鸣的动容。,5,活着 
相比于小說，電影做了很多去銳化的處理，同時葛優的演出又在很大層度上帶來了一種詼諧和幽默的效果，尤其是那個頗為圓滿的結局，很大地弱化了原著的悲劇況味和人生體悟。或者，這是一種積極地改編，老謀子一直以來的樂觀堅韌和淳樸，那種小人物的悲悲喜喜離離合合到最後都妥妥帖帖，雞到牛的小小滿足。,4,活着 
对于看过原著的人来说，本片剧情的震撼力明显不足，但考虑到中国电影尤其是社会题材的中国电影如同在雷区中前行的背景的话，那么这部电影还是具有很高的价值和意义的。,4,活着 
开硬盘的时候又重温了张艺谋的这部电影，不得不说，以前的比现在的好看了，不讨论是否变好变坏，总之觉得不如从前那么接受了，这个大赞~,5,活着 
一出人间惨剧，比原著更有震撼力和感染力,5,活着 
年代记实录，看了让人不舒服，特别是里面的台词，虽然他们在拼尽全力的活着，可是却又显得如此可笑和悲凉。,4,活着 
"拍出活著的張藝謀是令人欽佩的, 沒有刻意的運鏡, 只抓住了一個有分量的劇本就足够了. 時代中顛簸起伏的小人物的命運, 個人的遭遇與時代的變遷結合在一起, 無奈辛酸悲涼, 但也有不屈韌性和溫情, 那個時代, 那些人, 這樣活著.",5,活着 
时代造就人生，社会的悲剧最终都会造成家庭的悲剧。而一家人能够团结在一起其乐融融更比什么都重要。这样，或许安顺地过日子就是我最平凡的乞求。两位主演的表现更是给了我一种家人般地亲切感觉。整片苦涩平凡，不失温情。但是苦涩总戏剧性地发生，虽然之后想来却又都设铺垫，让人觉得度过一生实属不易,5,活着 
"记得当年刚上大学的时候,在公选课上看的这部电影的原著,眼泪止不住的往下流.",5,活着 
家珍说：“记着，你欠我们家一条人命，要好好活着啊。”,4,活着 
没有文字那么让人撕心裂肺，还原度十有八九吧。其实福贵的一生多多少少都有那个年代普遍大众的缩影，所以可想而知当年活着就是最好的宿命了。友庆和凤霞的离世让我久久不能平静，没想到余华的文字有如此强大的力量！另外电影的选角很成功，演员都很出彩,4,活着 
