好早以前看的了，当时特别喜欢上官海棠，人设太好了，刚出场时英姿飒爽一点不输男子！剧中还穿插好多搞笑桥段！归海一刀是霍建华角色中最喜欢的一个，刀棠cp好虐！最后海棠竟然死了！！啊啊啊,4,天下第一
当时的叶璇很惊艳，剧也好看。,4,天下第一
当当当当当~与《仙剑奇侠传》并列我十岁时最爱的电视剧……,4,天下第一
喜欢一刀和海棠。有被柳生雪姬惊艳到，飘絮就是造型不好看,4,天下第一
初中时候看觉得霍建华好帅啊,4,天下第一
小学的时候几个小朋友一起演这部戏2333333333,4,天下第一
海棠的死是我这么多年来心里的梗。。悲剧才能打动人心吗,4,天下第一
童年回忆，最近又拿出来看了，就是海棠不是当年的海棠了,5,天下第一
我记得成是非和郡主这对很欢乐，上官海棠很英气，归海一刀很帅，曹公公死的时候我以为要大结局了，没想到铁胆神侯才是最终BOSS,4,天下第一
虽然前后bug太多，编剧简直随心所欲。但好看啊，一刀实在是太太太帅了，海棠的男装绝对在我心中前几。演员选的都太好了。,4,天下第一
上官海棠…为什么要死了，当时看到这好伤心…喜欢那时候的叶璇,4,天下第一
小时候的记忆啊，那时候为了追这个剧真是冒着作业写不完的风险，最近重温，三天追完了，还是觉得挺不错。,5,天下第一
当年为了霍建华和叶璇看的,4,天下第一
昨天下午过了一遍。三十六天罡说：我们三十六天罡可是千里挑一，从三千六百人里挑选出来的。我算了算，好像不对....,4,天下第一
段天涯是外表看似冷酷，内心其实很温暖。,4,天下第一
小时候很喜欢的一部剧，演员卡司强大，且演技都在线，时隔多年，重新拾起这部剧，还是觉得很精彩，可能现在粗制滥造的剧太多了吧,5,天下第一
明星阵容真强大呀，很早看的一部剧了，海棠和一刀太虐了😭,4,天下第一
好想让一刀和海棠在一起啊！还喜欢郭晋安！还有刘松仁！电视剧里的大制作了！不过李亚鹏在扶桑的那段不好看！不喜欢黄圣依,4,天下第一
最喜欢成是非和云萝郡主，是最完美的结局了，最心疼一刀和海棠，好不容易在一起却又永久分开，当年的黄圣依很美，演得也很好，没想到搭上扬子的船，想想神候大boss若不是因为飘雪喜欢上天涯引发后面许多事，搞不好神候真的成了，大咖云集啊，王晶现在只会拍烂片了，和于妈一样,4,天下第一
“我只要做你心里的第一~为甚么你眼里却还是犹疑~”这就是一刀对海棠唱的啊！当年爱死了好么！一刀苦恋海棠最后几集了才修成正果，尼玛最后海棠居然死了啊！！,4,天下第一
卡司强，剧情雷，武戏佳，把王晶换成任意一位香港导演估计都能提升不少,4,天下第一
除了少量剧情上的BUG，剧情、武术、音乐、分镜都相当优质了。剧集中最喜欢的部分竟然是天涯在东瀛的那一段，拍得太美。最喜欢的CP则是成是非和云罗，嬉笑欢闹却用情至深。,4,天下第一
不得不说最后的剧情反转真的是太6666666了，当年看的时候可讨厌柳生了，我的海棠一刀啊(╥╯﹏╰╥)然后就是……华哥真好看！,4,天下第一
好好坏坏，到底什么是好什么是坏？心疼几个徒弟……,5,天下第一
就是情节很多，然后七七八八的有点多，哎，还是以前的电视剧好看呀！！现在的电视剧都是什么鬼！！霍建华那时候真年轻！！,4,天下第一
最爱上官海棠，唯一分不清男女主的剧，感觉都是主角,4,天下第一
把郭晋安替换掉就完美了，表演风格太夸张。李亚鹏和黄圣依在湖面上交叉掠过的那场戏很唯美啊，根本就是模仿李连杰和梁朝伟在“英雄”中九寨沟湖面上的那场对打戏。高圆圆的古装扮相让人惊艳。,4,天下第一
虽然剧情有些狗血，但是霍霍和叶璇都好喜欢啊～一刀和海棠都好帅，好配啊～～,4,天下第一
超爱公主和成是非。,4,天下第一
霍建华好帅~\(≧▽≦)/~,4,天下第一
当年冲着王晶和刘松仁去看的，却爱上了孤傲忧郁痴情的归海一刀，海棠死的时候心为一刀而碎！,5,天下第一
那时候的海棠的，真是又帅又美~~,4,天下第一
高中时代的记忆……,5,天下第一
当初每个演员都好喜欢啊,4,天下第一
这么多年，一刀和海棠的爱情一直让我耿耿于怀。,4,天下第一
哇当年真是疯狂的喜欢，海棠让我至今对叶璇都抱有好感_(:з」∠)_,4,天下第一
小时候还挺喜欢。。。。,4,天下第一
那个时候就觉得皇上身边的大内高手很屌，不光武艺高强，而且有皇上给的金牌畅通无阻。后来知道这群人叫“锦衣卫”的时候，就感叹，连名字都这么酷，肯定很会玩，真的感叹他们很会玩！！！！,5,天下第一
那些年看过的电视剧之叶璇当年好帅，华哥也是真绝色^_^,5,天下第一
华哥演的一刀好帅，海棠也很美，成是非好搞笑.,5,天下第一
好喜欢海棠和一刀这对，其次郡主和成是非。都挺可爱的。海棠人设很招苏，一刀忠犬痴情。这对BE一直是我心里的痛TAT不过也肯定是因为BE了才能让我即使过去十年了还记得……台词都会背了hhh要是发糖的时间再多一点就好了。打戏很精彩。,5,天下第一
初中还是高中的时候看的，喜欢霍建华和叶璇，为了这个还特意买了整套正版vcd！,4,天下第一
somehow我记忆最深的是皇上和海棠…那一句“鸳鸯戏水”可以说被我幻想了很久(小时候),4,天下第一
童年经典，叶璇的海棠至今让我念念不忘，人设很出彩，云罗郡主也很可爱啊,4,天下第一
霍建华帅帅的好吗，叶璇死得太早了,4,天下第一
绝对是颜值的盛宴！很好看！很喜欢！看了好多遍,4,天下第一
真的觉得海棠的男装是独一无二的，喜欢海棠和一刀这对苦命人。一刀真的美死了。,4,天下第一
看的时候，觉得霍berber好帅啊，。却是他很帅，还有叶璇，也好帅啊。可惜她离开TVB了，可惜了可惜了。,4,天下第一
最爱这种德高望重师父是大反派设定。,4,天下第一
我居然最爱海棠和沈万三，飘絮和天涯。他们分别在一起不就啥事都没了吗😊,4,天下第一
剧情不错，挺虐的。霍建华很帅啊。,4,天下第一
童年时期的内地连续剧多妙啊……永远无法忘记的上官海棠和归海一刀……以及霍建华的主题曲。,5,天下第一
主要明星很多~~当时里面很喜欢霍建华的！,4,天下第一
很喜欢叶璇在里面的感觉……帅……不喜欢李亚鹏，败,4,天下第一
好看，很经典，里面的各位演员颜值不错。成是非搞笑担当,4,天下第一
霍GG，璇MM，这是一部偶像武侠有木有！,4,天下第一
小时候看过的超精彩的武侠剧，那时候被霍建华演的归海一刀迷的不要不要的，海棠的风流倜傥，男装扮相超帅，只可惜这对CP最后没在一起。,4,天下第一
对上官海棠这类角色真是毫无抵抗力,5,天下第一
上官海棠这种带有英气的女子让人难以忘怀，剧情很不错。爱过,4,天下第一
哈哈哈搜张卫健看到的 可是我都不记得有张卫健诶？小时候好宣叶璇,4,天下第一
叶璇是我至今见过女扮男装最自然，最英俊的女演员。所以一直对她黑不起来。印象最深刻的还是云萝和成是非这一对，斗嘴太有爱。最让我没想到的是神侯居然是大boss，太意外,4,天下第一
那个时候大爱霍建华，只想他跟叶璇在一起，但是海棠最后居然就那么没了。,4,天下第一
我会说我第一眼真的以为上官海棠就是男的么,4,天下第一
喔，霍建华的天下第一。,4,天下第一
小时候看的时候好爱叶璇跟霍建华这对CP~对男装的叶璇毫无抵抗力，上官海棠是这样，孟丽君也是这样~,4,天下第一
站的cp是悲剧😔😔😔,4,天下第一
段天涯超级大渣男；成是非废话太多；归海一刀腹黑傲娇，唯一正常的只有海棠，还死了！,4,天下第一
叶璇在里面是真的又美又帅！,4,天下第一
我真的觉得也还好看（殴,4,天下第一
当年看美女还是很兴奋的，如果现在看估计是三星。,4,天下第一
那时真不懂，原来霍建华这么帅！！！！,5,天下第一
“天下第一，原以为这是中国原创武侠的开始、却没想到是巅峰。”,5,天下第一
叶璇饰演英气女子真棒！,4,天下第一
首先喜欢的是成是非和云萝，这对可人儿是唯一的一对幸福结局的。接着是叶璇，海棠给她演的格外出彩。再然后是归海一刀，果然帅啊帅啊~,4,天下第一
叶旋很漂亮。。。,4,天下第一
因为这部剧我看人民的名义的时候总有点恍惚hhh这里的海棠美好的不行，死的时候超级心酸，心疼归海一刀和海棠。,4,天下第一
爱看武侠的人都不会错过 现在回头看 大咖云集啊,4,天下第一
大众口味，演员不错。,4,天下第一
在无金庸古龙武侠原著的基础上，这是最好的一部剧。,5,天下第一
这五分给霍建华和他唱的你的第一，我爱帅哥爱帅哥爱帅哥,5,天下第一
海棠身死的那一刻，真的恨透了飘絮,4,天下第一
自从看了这部剧，我觉得霍建华后来所有的古装扮相都不如这个，以前挺喜欢叶璇的女装的，后来变成觉得她的女装都没这里面的男装帅,5,天下第一
一开始好嫌弃男主的颜值哦！后面就。。。越看越好看了，上官海棠和归海一刀的故事真的哭死我！还有大反派师傅吗？我忘记名字了，为了心爱的女人做尽坏事，但是她自杀了（还是整个头割下来那种）哇哇哇给我留下了好深的印象啊！,4,天下第一
就是在这里发现女性帅起来就没有男性什么事儿了，终于知道了什么叫陌上人如玉，公子世无双，上官公子你真的好酷啊,4,天下第一
阵容超级强大的片子啊，记得最后结局挺惨的,4,天下第一
"才发现编剧有王晶这么亮瞎眼的名字，当年难得的好剧~~才发现00到05的好多古装剧我都看过,小学时代啊,童年的回忆",4,天下第一
归海一刀啊 迷死人啦 还在家读中学的回忆呢 ,5,天下第一
我记得我看过 很爱主题曲,4,天下第一
喜欢叶璇，多加一颗星星,4,天下第一
这部剧几乎集合了各种可能的对武侠的遐想。大杂烩什么的看着也挺热闹。现在看着荧幕上三代令狐冲同屏对戏，莫名喜感。里面甚至还出过一句神预言：“今后和女孩子交往可要小心，人家可能是男人啊！”~~,4,天下第一
还ok 但是莫名其妙的看了好几遍....,4,天下第一
真的好看！王晶北上的诚意之作。已经看过三四遍了吧。印象深刻的其实是DK客串的，扎双马尾的不败顽童古三通，可爱～,4,天下第一
只要是主要是喜欢演员,4,天下第一
成是非很好玩啊，海棠死的时候我真的一脸懵逼啊。小时候可喜欢看了。,4,天下第一
霍建华好帅，叶璇最后的女装很惊艳,4,天下第一
海棠很帅，归海一刀也很冷漠无情，高圆圆的日本人很漂亮，虽然李亚鹏不够帅，但还是很喜欢看他演戏，演技很棒。,4,天下第一
这辈子看过的最超神级片头，没有“之一”。,5,天下第一
这部的华哥多帅，叶璇多美啊,4,天下第一
剧本是硬伤,4,天下第一
回头看依然很喜欢海棠和一刀。,5,天下第一
喜欢前五分之四的剧情，也就是朱无视原型毕露前的剧情。因为节奏得当，人物演绎到位，发展脉络耐人可寻。最后五分之一的剧情发展太快，所有一切都翻盘，感觉被坑了。,4,天下第一
喜欢张卫健霍建华,5,天下第一
小时候很喜欢，天字第一号，地字第一号，什么的，海棠是女神,5,天下第一
印象里特别好看，叶璇真是惊艳啊,4,天下第一
是好剧，不过有几点很奇怪，段天涯是男一，但剧中明显弱化，成是非和归海一刀的存在感和重要性明显比段天涯要强，上官海棠应该算是女主但半途领了盒饭？这仅仅是为了打破以往武侠剧的套路吗,4,天下第一
叶璇的这个角色是我最喜欢的(≧▽≦)一刀里面也是很帅(≧▽≦),4,天下第一
叶璇在这里面真美,4,天下第一
从此爱上了一刀= =,4,天下第一
小时候很喜欢这部剧。不得不说大家的演技都特别好，尤其是刘松仁的神侯。因为曹公公的坏是坏在表面，所以我就一直以为他是一直坏下去的。一刀的官配一定是海棠，成是非的官配一定是云罗，神侯喜欢素心，只是不知道素心喜不喜欢他；唯一不知道的就是天涯喜欢雪姬多一点还是飘絮多一点。,4,天下第一
绝逼好看！剧情好！每个演员演技大赏！,4,天下第一
明星还能再多点吗，叶璇你还能再美点嘛,5,天下第一
霍霍好帅,4,天下第一
超级华丽丽~,4,天下第一
童年的回忆啊。。。,4,天下第一
一堆画风不一的明星云集了，叶璇霍建华的刀棠恋很感人，邓超演的小皇帝也蛮个性，高圆圆很冷艳，郭靖安搞笑，居然还有张卫健，一点印象都没了。当时对李亚鹏演男主有点不满。,4,天下第一
喜欢上官海棠，叶璇男装真俊。里面帅哥美女真多。,4,天下第一
当年觉得可高端了！,4,天下第一
那时候很萌叶璇呐。,4,天下第一
我对这部剧的所有好感全停留在了海棠死的那一刻T.T，之后几集就弃剧了,4,天下第一
很多年看的了 就记得叶璇,4,天下第一
当年超爱啊....被霍建华叶璇迷死了,5,天下第一
超喜欢！当然作为武侠剧是有点超出人类认知，但是真的很好看！情节紧凑，人物性格鲜明，服化也不错！,5,天下第一
良心之作！！尼玛卡司阵容强大就不必说，开头BGM秒心碎~~我的男神女神们~~~,5,天下第一
对叶璇越来越无感了,4,天下第一
紧看都觉得好看。就浓王晶这种豪华阵容乱演乱演神垮垮的。一刀和海棠确实是一对不可多得的银幕形象啊。喜欢片头的音乐，当当当当当~当当当当~当当当当当当~~就是这样的,4,天下第一
剧情脑残，衍生剧情美,4,天下第一
两岸三地大咖特多 随便一个现在都是主角 以前的武侠剧情都很好看,5,天下第一
过去电视上一集一集半夜追完的剧集 现在回想，印象里还是相当不错~①喜欢上华哥的戏 ②喜欢里面高圆圆的角色 ③那会儿的叶璇还没残,4,天下第一
虽然叶璇近几年的感情生活颇为人诟病，不过每个人都有自己的生活方式，在没有违背道德底线的情况下，他人的任何行为活动都只是人家的选择自由而已。我们是不是也可以更包容一些呢？是不是可以把关注点放在她的演戏事业上呢？说了这么多，我就想表达我挺喜欢这个演员，也喜欢海棠这个角色。,5,天下第一
反反复复看过很多遍，直到最近的一次才深深的有所体会，其实侯爷对素珍根本谈不上爱，只是为了感动自己而一直在坚持况且他自己也说：“她就是我的一个梦”，但是也能看的出神候也是动了感情，不然最后不会被打败，不过最喜欢的还是里面的曹正淳，演的真的蛮好的！！,4,天下第一
小时候的武侠真好看，演员阵容好强大。,5,天下第一
那时候没有那么多特技，看起来却格外舒服。,4,天下第一
天下第一庄，一直觉得上官海棠与段天涯最配,5,天下第一
小时候特迷一刀海棠这对！！而且叶璇的上官海棠太英俊了～,4,天下第一
赞，叶璇和霍建华这对的结局哭死我了,5,天下第一
有空还是得去找粤语的碟来看...,4,天下第一
没有好好追过⋯⋯但经常播到就看了⋯⋯,4,天下第一
当时并没发现有这么多明星，只觉得归海一刀很帅，只能说霍建华这个人物塑造的不错。郭晋安的傻子形象说实话并不讨喜。,4,天下第一
看过很多遍，天地玄黄，天下第一！背景音乐非常好听，跟剧情很配；最喜欢成是非和云罗这对couple，搞笑幽默；叶璇的男装太帅了，女装也太美了，最喜欢的角色，叶璇那时的演技怎么那么好，再看看现在；曹正淳的演技第一，毫无疑问！,5,天下第一
歌词“能不能有这种荣幸，抱紧你”,4,天下第一
当时爱惨了霍建华。。。。。,4,天下第一
当年看的时候蛮欢乐，一刀海棠是追剧点啊，邓超亮了,4,天下第一
海棠没事，一刀便放心了,4,天下第一
也算是童年最爱了   虽然现在不太能记得具体剧情了   但记的天涯   一刀   海棠   飘絮    成是非   郡主啊    踩个印记录一下   ,4,天下第一
重新看了一遍天下第一，这是太太很喜欢的连续剧，因为里面的霍建华很帅。除了剧情上有硬伤外，不可否认是部不错的连续剧啊，看的挺开心的，可是看完了，会想她。,4,天下第一
远烟一般的往事了。,5,天下第一
以前看过还不错额。。。,4,天下第一
那么多星都给霍建华,4,天下第一
喜欢叶璇霍建华这一对,4,天下第一
又是一部超虐的电视剧，要是都像成是非和云罗郡主一样就好了！,4,天下第一
哇，可好看了，喜欢黄圣依的柳絮,5,天下第一
前天听到客厅放出主题曲就被触动了妈的 于是和我爸看了整整两天 还是很喜欢啊,5,天下第一
记得那时候大家都是为了看陈冠希......结果刚出来就死了==,3,天下第一
喜欢叶璇和霍建华,3,天下第一
原本以为阴谋就此结束的四人此时却发现，原来皇帝的痴傻实为伪装，而身边最大的阴谋家正是养育他们长大，却窥探皇位二十多年的神侯！,3,天下第一
所以说中国的编剧总是缺乏想象力，朱无视霸气逼人，屌的尿骚，人又帅，又有事业心，武功还这么牛掰，从任何层面看都是做皇帝的最佳人选，为了剧情需要就把他写死了，太不符合常理了,3,天下第一
喜欢叶璇，挺好看的，可惜是悲剧！,3,天下第一
有一阵子挺迷叶璇，后来不知怎么的就走偏了,3,天下第一
上官海棠和归海一刀，结局只有他俩是悲剧,3,天下第一
当年被虐的死去活来的一刀跟海棠。,3,天下第一
武侠片，好看的。霍建华，帅的。,3,天下第一
特地从某人消失之后才开始看，看到中间就把前面补齐了。看这片都不讨厌李亚鹏了真神奇。,3,天下第一
天地玄黄，各有所长。上官公子！叶璇男装秒女装。归海一刀是白豆腐的角色里最喜欢的一个了。,3,天下第一
搞笑诙谐，郭晋安的金身厉害啊！整部剧只记得这个金身！,3,天下第一
最近老在讲东方菇凉。。所以。。就来瞅瞅霍先森了。（有关系吗=- =）小时候看过的呢。那时候还不觉得大牌多。。。现在一看全是大牌啊。不过我还是要吐槽一下。。神一样的编剧啊。说谋反就谋反，竟然一点征兆都没有。。太假了。前后完全不连贯。,3,天下第一
电视剧里面最喜欢的大概是陈法蓉和张卫健这一对了，不知道为什么会不喜欢，故事发展也看的纠结。,3,天下第一
其实，那个时候的璇，真的很海市。只是，我已经找不到那个鉴明了。,3,天下第一
没想到霍建华和李亚鹏还一起演过戏。,3,天下第一
有两个女子办男装惊艳到我，一个是叶璇，一个是黎姿。。,3,天下第一
这个电视剧感觉好长啊，喜欢海棠和归海一刀这条线，其他的感觉没什么意思，那时演这剧的演员现在都是大咖啦,3,天下第一
拍得很俗啦，但是看这种武侠剧就像打一部早期国产武侠RPG或者看一本热血漫画一样，合格的消磨时光好陪伴,3,天下第一
怎么不记得见到高圆圆了？？她演得谁啊,3,天下第一
当时觉得霍建华好帅，和男装的叶璇太萌了，可惜两个都不是主角，主线剧情又很雷，实在坚持不下去，反正也被OP剧透了知道这对最后BE╮(╯▽╰)╭,3,天下第一
记忆中这是一个很多大牌剧情很囧的剧,3,天下第一
总算有一部可以给三星的古装片了……,3,天下第一
换掉李亚鹏就多给一星。成是非云罗很可爱，但比起海棠一刀他俩也太幸福了吧！后一对那么迟才对上眼，一场甜蜜恋爱戏都没有，海棠就挂了。《你的第一》好听，但敢不敢多给霍建华几个镜头啊！比起海棠甚至更喜欢一刀啊……黄圣依剧中蛮美的,3,天下第一
虽然剧情现在看挺假，不过叶璇作为女主居然死了 实在是给我很大的震撼！！,3,天下第一
霍建华不错，更爱陈法蓉。。。更可怕的是我居然喜欢里面黄圣依所演的那个角色，哦，想起来了，叫柳生雪姬。她的这部分剧情我喜欢。,3,天下第一
哦哦突然想起来小时候看过这片，小时候怎么都看这种现在想来蠢爆了但是当时又觉得很好看的片子,3,天下第一
大牌云集 我貌似看过一、两集 没什么印象了~ ,3,天下第一
当年还小，可喜欢了。现在这样的剧迷不到我了,3,天下第一
很经典，很好看，颜值高演技也还行。推荐推荐,3,天下第一
此剧播出的时候，我们村正流行安装卫星锅盖，我最早在星空卫视看过它。原来是王晶手笔，集齐两岸三地明星。此剧是我对叶璇唯一的印象；对太监总管印象深刻，后来知道饰演者是李建义；记住了皇帝和饰演者邓超，可能这个名字太好记，后来竟然这么火。,3,天下第一
海棠是我的初代男神啊，小学那会简直是痴迷了，最后死的时候哭惨了。,3,天下第一
其实我觉得剧情一般哈，有些讲不通得地方，而且延伸了很多跟剧情无关的细枝末节，大家辛辛苦苦学来的绝世神功，除了成是非，都没怎么用到。。。不过演员阵容太强大了，估计是有史以来明星最多的一部武侠剧了。李亚鹏的表演很到位，最传神的还是张卫健的表演，虽然只有短短几出戏，但是表演得出神入化，把一个顽童刻画得不要太深。,3,天下第一
冲着霍建华的归海一刀看的，跟叶璇挺配的，看完很喜欢成是非和邓超演的皇帝，刘松仁演技超级赞。,3,天下第一
不喜欢李亚鹏,3,天下第一
只有我一个人觉得天下第一和名捕震关东有点像么？海棠蛮不错的。,3,天下第一
阵容真心不错哈哈 郭晋安太欢乐了 不过摄像太糟糕了 DOP在想什么哇。。。,3,天下第一
看这部电视剧的时候我还在上高一吧 当时被霍建华迷到不行 虽然也很喜欢叶璇饰演的上官海棠吧 不过 我总觉得她不如高圆圆好看捏。。。而且最后上官海棠不应该那么死啊 太假了 现在再看 觉得剧情有点七拼八凑的 但是为了霍璇 我忍。。。,3,天下第一
看剧的时候好喜欢海棠和归海一刀,3,天下第一
貌似看了很多遍……不是因为好看，是因为寂寞……,3,天下第一
程小东是挂名的吧，里面东瀛部分倒是有点程小东的风格，但是道具服装都很山寨，日本人佩刀刃朝下,3,天下第一
反正加了个李亚鹏就绝望了。。。,3,天下第一
剧中主角，现在看，个个都是话题人物。结局忘记了，记得高圆圆又演了个周芷若。黄圣依的扮相很美，可惜早死了，郡主貌似也死了，成是非跟个傻子似的。别的忘了。“不稀罕做谁的天下第一，只想永远做你心中的唯一”,3,天下第一
有点2还可以吧,3,天下第一
在高圆圆成为小清新的女神时，她在我心里早就被这部和倚天屠龙的两个角儿定型了——不要脸的小三女奸人。,3,天下第一
其实就是部数星星作品  女生造型真是一言难尽啊,3,天下第一
好多牌牌啊 哈哈 霍建华,3,天下第一
很多年前了吧。。,3,天下第一
啧啧，当时迷得哟、、、,3,天下第一
只能说角色塑造太成功了！！！剧情其实挺一般的！！！,3,天下第一
影评.txt 2014.2.10,3,天下第一
当年是下载到电脑里看的，为了海棠和归海一刀，我一直拉进度条，而现在一刀已经结果，海棠也不是原来的海棠了……哎物是人非,3,天下第一
那个时候觉得黄圣依很美啊。。。那部剧也注定让高圆圆在我眼里不太美得起来。。。。。。。霍建华演冷面人还是比较合适。。。陈仪容也很美。。。。。,3,天下第一
每到假期就会播啊 也算是经典了 只记得高圆圆和黄圣依的和服装扮很美~,3,天下第一
酷哥酷姐的，面瘫什么在这里就特别合适。。。各自的爱情和人生，都搅卷在江湖和朝堂的局势纷争之中。天涯和东瀛两姐妹，海棠和一刀，神侯和素心古三通，这几对略悲情，相爱的同时背负了太多东西，所以纯粹欢乐的郡主和黄黄才能在最后获得幸福吧···看这部我成了便当控，妹子死得心碎又凄美,3,天下第一
